{
  "$schema": "https://json-schema.org/draft/2020-12/schema",
  "$id": "https://github.com/ricoberger/new-shores/assets/recipes/schema.json",
  "title": "New Shores model recipe",
  "description": "One kit-bashed model per content ID (ART_DIRECTION §7). Coordinates are in tiles (1 tile = 4 m) in recipe space: Blender axes, z up, origin at the footprint's ground centre, the front edge (the door at rotation 0) toward +y; ships: bow toward +x, origin at the waterline centre. Rotations are XYZ Euler angles in degrees. The footprint is read from content/old_coast, never repeated here. Validated by assets/build/nsassets/schema.py (stdlib subset of JSON Schema: type, enum, const, required, properties, additionalProperties, items, minItems, maxItems, minimum, maximum, exclusiveMinimum, pattern, minLength, $ref, oneOf).",
  "type": "object",
  "required": ["id", "kind", "parts"],
  "additionalProperties": false,
  "properties": {
    "$schema": { "type": "string" },
    "id": { "type": "string", "pattern": "^[a-z][a-z0-9_]*$", "description": "Content ID (content/old_coast/buildings.json or ships.json), or decor_<name> for decoration." },
    "kind": { "enum": ["building", "field", "ship", "decor"], "description": "decor: island decoration (trees, bushes, rocks, tufts, stumps, outcrops) with an id starting decor_, not a content ID; listed under the manifest's decor key." },
    "notes": { "type": "string", "description": "What the model shows; production buildings name their signature prop." },
    "shading": { "enum": ["flat", "smooth"], "description": "flat (default): one normal per face; smooth: corner normals averaged over the faces of the same role sharing a position (rounded kit trees and bushes)." },
    "ao": { "enum": ["full", "crevices"], "description": "Baked ambient occlusion: full (default) or crevices (only the strongest levels, shifted down, so small decoration keeps its palette colour and darkens only in its crevices)." },
    "parts": { "$ref": "#/$defs/partList", "description": "Parts shared by every variant and level." },
    "variants": {
      "type": "array",
      "minItems": 2,
      "items": { "$ref": "#/$defs/partList" },
      "description": "Variant n (file <id>.v<n>.glb) = parts + variants[n]. Houses have exactly 3."
    },
    "levels": {
      "type": "object",
      "description": "Content level → parts (file <id>.l<level>.glb = parts + levels[level]).",
      "additionalProperties": false,
      "properties": {
        "1": { "$ref": "#/$defs/partList" },
        "2": { "$ref": "#/$defs/partList" },
        "3": { "$ref": "#/$defs/partList" }
      }
    },
    "attachments": {
      "type": "object",
      "description": "Separately exported parts drawn on top of the model (<id>.<name>.glb).",
      "additionalProperties": false,
      "properties": {
        "cargo": { "$ref": "#/$defs/partList" }
      }
    },
    "ship": {
      "type": "object",
      "required": ["length_tiles", "masts", "sail_scale"],
      "additionalProperties": false,
      "properties": {
        "length_tiles": { "type": "number", "exclusiveMinimum": 0, "maximum": 10 },
        "masts": { "type": "integer", "minimum": 1, "maximum": 4 },
        "sail_scale": { "type": "number", "exclusiveMinimum": 0, "maximum": 4 }
      }
    },
    "budget_exception": {
      "type": "object",
      "required": ["reason"],
      "additionalProperties": false,
      "properties": { "reason": { "type": "string", "minLength": 10 } },
      "description": "Doubles the building budget; only warehouse, shipyard, chapel and market_small."
    },
    "anchors": {
      "type": "object",
      "additionalProperties": false,
      "properties": {
        "door": { "$ref": "#/$defs/vec3" },
        "chimney": { "$ref": "#/$defs/vec3" },
        "smoke": { "$ref": "#/$defs/vec3" },
        "status": { "$ref": "#/$defs/vec3" }
      }
    }
  },
  "$defs": {
    "vec3": { "type": "array", "items": { "type": "number" }, "minItems": 3, "maxItems": 3 },
    "vec2": { "type": "array", "items": { "type": "number" }, "minItems": 2, "maxItems": 2 },
    "role": { "type": "string", "pattern": "^[a-z][a-z0-9]*(-[a-z0-9]+)*$", "description": "A colour name of the buildings, terrain, fields or water group of assets/palette.json." },
    "partList": { "type": "array", "items": { "$ref": "#/$defs/part" } },
    "part": {
      "type": "object",
      "description": "A kit piece (kit + file, or kit_building), or a procedural primitive (prim + its parameters), placed by position/rotation/scale.",
      "additionalProperties": false,
      "properties": {
        "name": { "type": "string", "description": "Label in error messages (default: file or prim and the index)." },
        "kit": { "enum": ["kaykit_hexagon", "kaykit_forest"] },
        "kit_building": { "type": "string", "description": "A whole kit building by name (KIT_BUILDINGS in assets/build/nsassets/config.py, e.g. home_A, church, lumbermill, windmill, scaffolding) — the kit piece turned so its front faces +y; replaces kit + file and takes the kit-piece options (roles, drop, crop, exaggerate, simplify) and transforms." },
        "file": { "type": "string", "description": "Kit-relative path as listed in assets/kits/MANIFEST.json." },
        "prim": { "enum": ["box", "cylinder", "wedge", "sail", "lathe", "rock"] },
        "size": { "$ref": "#/$defs/vec3", "description": "box: x y z (base centred at z = 0); wedge: ridge length x, depth y, height z; rock: radii x y z." },
        "radius": { "type": "number", "exclusiveMinimum": 0, "description": "cylinder: bottom radius." },
        "radius_top": { "type": "number", "minimum": 0, "description": "cylinder: top radius (default = radius; 0 = cone)." },
        "height": { "type": "number", "exclusiveMinimum": 0, "description": "cylinder, sail." },
        "segments": { "type": "integer", "minimum": 1, "maximum": 32, "description": "cylinder, lathe: sides (≥ 3); sail: rows." },
        "caps": { "type": "boolean", "description": "cylinder: draw the top and bottom caps (default: top only)." },
        "open": {
          "type": "array",
          "items": { "enum": ["top", "bottom", "+x", "-x", "+y", "-y"] },
          "description": "box: faces left out (unseen faces cost triangles)."
        },
        "hip": { "type": "number", "minimum": 0, "description": "wedge: hip inset of both ridge ends (0 = gable roof)." },
        "width": { "type": "number", "exclusiveMinimum": 0, "description": "sail: bottom width (along x)." },
        "width_top": { "type": "number", "minimum": 0, "description": "sail: top width (0 = triangle; default = width)." },
        "bulge": { "type": "number", "description": "sail: depth of the wind belly toward +y." },
        "profile": { "type": "array", "items": { "$ref": "#/$defs/vec2" }, "minItems": 2, "description": "lathe: (radius, z) points from bottom to top, revolved about z." },
        "detail": { "type": "integer", "minimum": 0, "maximum": 1, "description": "rock: 0 = octahedron-like, 1 = subdivided." },
        "bevel": { "type": "number", "exclusiveMinimum": 0, "maximum": 0.2, "description": "Primitives: bevels the sharp edges (> 30°) by this width (tiles, one segment; Blender bevel modifier) — softer, chunkier silhouettes for about 3× the triangles." },
        "position": { "$ref": "#/$defs/vec3" },
        "rotation": { "$ref": "#/$defs/vec3" },
        "scale": { "oneOf": [{ "type": "number", "exclusiveMinimum": 0 }, { "$ref": "#/$defs/vec3" }] },
        "repeat": {
          "type": "object",
          "required": ["count", "step"],
          "additionalProperties": false,
          "properties": {
            "count": { "type": "integer", "minimum": 1, "maximum": 64 },
            "step": { "$ref": "#/$defs/vec3" },
            "rotate": { "type": "number", "description": "Extra rotation about z (degrees) per copy." }
          },
          "description": "Copies the part count times, each moved by step (tiles, recipe space) from the previous."
        },
        "role": { "$ref": "#/$defs/role", "description": "Colour of the whole part (required for primitives)." },
        "roles": {
          "type": "object",
          "additionalProperties": {
            "oneOf": [
              { "$ref": "#/$defs/role" },
              {
                "type": "object",
                "required": ["role"],
                "additionalProperties": false,
                "properties": {
                  "role": { "$ref": "#/$defs/role" },
                  "shade": { "type": "number", "minimum": 0.5, "maximum": 1.5, "description": "Replaces the kit default shade (times the part shade and, for gradient atlases, the band shade)." }
                }
              }
            ]
          },
          "description": "Kit material name (atlas kits: Atlas/<swatch>; gradient atlases also Atlas/<swatch>@<band>, band 0 = light … 2 = dark) → role or {role, shade}; other materials keep the kit default."
        },
        "drop": {
          "type": "array",
          "items": { "type": "string" },
          "description": "Kit pieces: materials left out (e.g. Atlas/stone to strip a KayKit plinth; gradient atlases by swatch or swatch@band)."
        },
        "shade": { "type": "number", "minimum": 0.6, "maximum": 1.2, "description": "Multiplier on the palette colour (default 1.0)." },
        "simplify": {
          "type": "object",
          "additionalProperties": false,
          "properties": {
            "dissolve": { "type": "number", "exclusiveMinimum": 0, "maximum": 45, "description": "Planar decimation angle limit (degrees), material borders kept." },
            "collapse": { "type": "number", "exclusiveMinimum": 0, "maximum": 1, "description": "Edge-collapse ratio of the remaining triangles." }
          },
          "description": "Mesh simplification of a kit piece (dissolve first, then collapse)."
        },
        "crop": {
          "type": "object",
          "required": ["min", "max"],
          "additionalProperties": false,
          "properties": { "min": { "$ref": "#/$defs/vec3" }, "max": { "$ref": "#/$defs/vec3" } },
          "description": "Kit pieces: keeps only the triangles whose centroid lies in this box (kit units, Blender axes, before any transform) — takes a part of a piece."
        },
        "exaggerate": {
          "type": "array",
          "items": {
            "type": "object",
            "required": ["min", "max", "scale"],
            "additionalProperties": false,
            "properties": {
              "min": { "$ref": "#/$defs/vec3" },
              "max": { "$ref": "#/$defs/vec3" },
              "scale": { "oneOf": [{ "type": "number", "exclusiveMinimum": 0, "maximum": 3 }, { "$ref": "#/$defs/vec3" }] },
              "pivot": { "$ref": "#/$defs/vec3" }
            }
          },
          "description": "Kit pieces: scales the triangles whose centroid lies in min..max (kit units, Blender axes, before any transform) about pivot (default: the selection's bottom centre), in order — e.g. a roof 1.3× or a chimney 1.5× taller (exaggerated silhouettes)."
        },
        "flip_normals": { "type": "boolean", "description": "Reverses the triangle winding (inside-out pieces)." },
        "lod": {
          "enum": ["full"],
          "description": "full = only in the full model: left out of the generated lite model. Every building is also exported as <file>.lite.glb (the model without these parts, decimated to ~25 %), drawn by the client at the near-LOD default zoom; the full model is drawn when zoomed in."
        }
      }
    }
  }
}
