{
  "$schema": "./schema.json",
  "id": "hop_field",
  "kind": "field",
  "notes": "Hop field (1×1): a green tile with two soil rows, each a row of three hop poles joined by a wire, green bines climbing every pole and pale hop cones hanging between them.",
  "parts": [
    {"name": "slab", "prim": "box", "size": [0.94, 0.94, 0.02], "open": ["bottom", "+x", "-x", "+y", "-y"], "position": [0, 0, 0], "role": "orchard", "shade": 0.92},
    {"name": "soil row", "prim": "box", "size": [0.16, 0.9, 0.02], "open": ["bottom", "-y", "+y"], "position": [-0.22, 0.0, 0.02], "role": "road-dirt", "shade": 0.9, "repeat": {"count": 2, "step": [0.44, 0, 0]}},
    {"name": "hop pole", "prim": "box", "size": [0.04, 0.04, 0.95], "open": ["bottom"], "position": [-0.22, -0.32, 0.0], "role": "timber", "shade": 0.85, "repeat": {"count": 3, "step": [0, 0.32, 0]}},
    {"name": "hop wire", "prim": "box", "size": [0.02, 0.76, 0.02], "open": ["bottom", "-y", "+y"], "position": [-0.22, 0.0, 0.92], "role": "iron", "shade": 0.9},
    {"name": "hop bine", "prim": "cylinder", "radius": 0.09, "height": 0.85, "radius_top": 0.04, "segments": 4, "position": [-0.22, -0.32, 0.03], "role": "hemp", "shade": 0.95, "repeat": {"count": 3, "step": [0, 0.32, 0]}},
    {"name": "hop cones", "prim": "cylinder", "radius": 0.07, "height": 0.18, "radius_top": 0.02, "segments": 4, "position": [-0.22, -0.16, 0.62], "role": "pasture-mark", "shade": 1.05, "repeat": {"count": 2, "step": [0, 0.32, 0]}},
    {"name": "hop pole", "prim": "box", "size": [0.04, 0.04, 0.95], "open": ["bottom"], "position": [0.22, -0.32, 0.0], "role": "timber", "shade": 0.85, "repeat": {"count": 3, "step": [0, 0.32, 0]}},
    {"name": "hop wire", "prim": "box", "size": [0.02, 0.76, 0.02], "open": ["bottom", "-y", "+y"], "position": [0.22, 0.0, 0.92], "role": "iron", "shade": 0.9},
    {"name": "hop bine", "prim": "cylinder", "radius": 0.09, "height": 0.85, "radius_top": 0.04, "segments": 4, "position": [0.22, -0.32, 0.03], "role": "hemp", "shade": 0.95, "repeat": {"count": 3, "step": [0, 0.32, 0]}},
    {"name": "hop cones", "prim": "cylinder", "radius": 0.07, "height": 0.18, "radius_top": 0.02, "segments": 4, "position": [0.22, -0.16, 0.62], "role": "pasture-mark", "shade": 1.05, "repeat": {"count": 2, "step": [0, 0.32, 0]}}
  ]
}
