{
  "$schema": "./schema.json",
  "id": "wheat_farm",
  "kind": "building",
  "notes": "Wheat farm: a KayKit home_A farmhouse (0.7) under terracotta and a timber barn; the yard shows the wheat field type: sheaves stacked in a fenced corner and a few wheat rows. Signature prop: the wheat sheaves.",
  "parts": [
    {"kit_building": "home_A", "position": [-0.8, -0.75, 0], "scale": 0.7, "roles": {"Atlas/team": "terracotta"}},
    {"name": "yard", "prim": "box", "size": [2.9, 2.9, 0.02], "open": ["bottom", "+x", "-x", "+y", "-y"], "role": "road-dirt", "shade": 1.08},
    {"name": "barn", "prim": "box", "size": [1.1, 0.9, 0.6], "open": ["bottom"], "position": [0.75, -0.8, 0], "role": "timber", "shade": 1.15},
    {"name": "barn door", "prim": "box", "size": [0.5, 0.03, 0.42], "position": [0.75, -0.34, 0], "role": "timber", "shade": 0.7},
    {"name": "field patch", "prim": "box", "size": [1.25, 1.05, 0.025], "open": ["bottom", "+x", "-x", "+y", "-y"], "position": [0.6, 0.75, 0], "role": "wheat", "shade": 0.9},
    {"name": "wheat row", "prim": "wedge", "size": [1.1, 0.14, 0.12], "position": [0.6, 0.35, 0.02], "role": "wheat-mark"},
    {"name": "wheat row", "prim": "wedge", "size": [1.1, 0.14, 0.12], "position": [0.6, 0.57, 0.02], "role": "wheat-mark", "lod": "full"},
    {"name": "wheat row", "prim": "wedge", "size": [1.1, 0.14, 0.12], "position": [0.6, 0.79, 0.02], "role": "wheat-mark"},
    {"name": "wheat row", "prim": "wedge", "size": [1.1, 0.14, 0.12], "position": [0.6, 1.01, 0.02], "role": "wheat-mark", "lod": "full"},
    {"name": "wheat row", "prim": "wedge", "size": [1.1, 0.14, 0.12], "position": [0.6, 1.23, 0.02], "role": "wheat-mark"},
    {"name": "sheaf", "prim": "cylinder", "radius": 0.091, "radius_top": 0, "height": 0.286, "segments": 5, "position": [-0.9, 0.55, 0], "role": "wheat", "shade": 1.05},
    {"name": "sheaf", "prim": "cylinder", "radius": 0.091, "radius_top": 0, "height": 0.286, "segments": 5, "position": [-0.65, 0.75, 0], "role": "wheat", "shade": 1.05},
    {"name": "sheaf", "prim": "cylinder", "radius": 0.091, "radius_top": 0, "height": 0.286, "segments": 5, "position": [-0.95, 0.95, 0], "role": "wheat", "shade": 1.05},
    {"name": "sheaf", "prim": "cylinder", "radius": 0.091, "radius_top": 0, "height": 0.286, "segments": 5, "position": [-0.55, 1.1, 0], "role": "wheat", "shade": 1.05},
    {"name": "sheaf", "prim": "cylinder", "radius": 0.091, "radius_top": 0, "height": 0.286, "segments": 5, "position": [-1.2, 0.75, 0], "role": "wheat", "shade": 1.05},
    {"name": "fence", "kit": "kaykit_hexagon", "file": "Assets/gltf/buildings/neutral/fence_wood_straight.gltf", "position": [-0.726, 1.285, 0], "rotation": [0, 0, 90], "scale": [0.45, 0.471, 0.3], "lod": "full"}
  ]
}
