{"$schema": "./schema.json", "id": "decor_crag_c", "kind": "decor", "notes": "Crag on the plateaus (KayKit Hexagon mountain_C, warm rock): breaks the plateau tops and step edges into a jagged silhouette.", "parts": [
  {"kit": "kaykit_hexagon", "file": "Assets/gltf/decoration/nature/mountain_C.gltf", "scale": 0.2, "roles": {"Atlas/rock": "rock-light"}}]}
