{
  "$schema": "./schema.json",
  "id": "woad_field",
  "kind": "field",
  "notes": "Woad field (1×1): a blue-green crop tile — three ridged rows of woad clumps alternating blue-green and green leaves, a few yellow flower heads on top.",
  "parts": [
    {"name": "slab", "prim": "box", "size": [0.94, 0.94, 0.02], "open": ["bottom", "+x", "-x", "+y", "-y"], "position": [0, 0, 0], "role": "hemp", "shade": 0.88},
    {"name": "woad row", "prim": "box", "size": [0.86, 0.18, 0.06], "open": ["bottom", "-x", "+x"], "position": [0.0, -0.3, 0.02], "role": "hemp-mark", "repeat": {"count": 3, "step": [0, 0.3, 0]}},
    {"name": "woad clump", "prim": "cylinder", "radius": 0.11, "height": 0.17, "radius_top": 0.05, "segments": 5, "position": [-0.3, -0.33, 0.06], "role": "shallows", "shade": 0.72},
    {"name": "woad clump", "prim": "cylinder", "radius": 0.1, "height": 0.2, "radius_top": 0.04, "segments": 5, "position": [-0.05, -0.27, 0.06], "role": "hemp", "shade": 1.1},
    {"name": "woad clump", "prim": "cylinder", "radius": 0.11, "height": 0.17, "radius_top": 0.05, "segments": 5, "position": [0.2, -0.33, 0.06], "role": "shallows", "shade": 0.72},
    {"name": "woad clump", "prim": "cylinder", "radius": 0.1, "height": 0.2, "radius_top": 0.04, "segments": 5, "position": [0.38, -0.27, 0.06], "role": "hemp", "shade": 1.1},
    {"name": "woad clump", "prim": "cylinder", "radius": 0.1, "height": 0.2, "radius_top": 0.04, "segments": 5, "position": [-0.3, -0.03, 0.06], "role": "hemp", "shade": 1.1},
    {"name": "woad clump", "prim": "cylinder", "radius": 0.11, "height": 0.17, "radius_top": 0.05, "segments": 5, "position": [-0.05, 0.03, 0.06], "role": "shallows", "shade": 0.72},
    {"name": "woad clump", "prim": "cylinder", "radius": 0.1, "height": 0.2, "radius_top": 0.04, "segments": 5, "position": [0.2, -0.03, 0.06], "role": "hemp", "shade": 1.1},
    {"name": "woad clump", "prim": "cylinder", "radius": 0.11, "height": 0.17, "radius_top": 0.05, "segments": 5, "position": [0.38, 0.03, 0.06], "role": "shallows", "shade": 0.72},
    {"name": "woad clump", "prim": "cylinder", "radius": 0.11, "height": 0.17, "radius_top": 0.05, "segments": 5, "position": [-0.3, 0.27, 0.06], "role": "shallows", "shade": 0.72},
    {"name": "woad clump", "prim": "cylinder", "radius": 0.1, "height": 0.2, "radius_top": 0.04, "segments": 5, "position": [-0.05, 0.33, 0.06], "role": "hemp", "shade": 1.1},
    {"name": "woad clump", "prim": "cylinder", "radius": 0.11, "height": 0.17, "radius_top": 0.05, "segments": 5, "position": [0.2, 0.27, 0.06], "role": "shallows", "shade": 0.72},
    {"name": "woad clump", "prim": "cylinder", "radius": 0.1, "height": 0.2, "radius_top": 0.04, "segments": 5, "position": [0.38, 0.33, 0.06], "role": "hemp", "shade": 1.1},
    {"name": "woad flowers", "prim": "box", "size": [0.06, 0.06, 0.05], "open": ["bottom"], "position": [-0.3, -0.33, 0.24], "role": "flower", "repeat": {"count": 3, "step": [0.25, 0.3, 0]}}
  ]
}
