{
  "$schema": "./schema.json",
  "id": "sailmaker",
  "kind": "building",
  "notes": "Sailmaker: a long KayKit home_A workshop (stretched, 0.75 x 0.6) under terracotta. Signature prop: a big canvas sail stretched on a timber frame in the yard, with rolled sails and rope.",
  "anchors": {"smoke": [-0.1, -1.033, 1.376], "chimney": [-0.1, -1.033, 1.326]},
  "parts": [
    {"kit_building": "home_A", "position": [-0.1, -0.55, 0], "scale": [0.8, 0.6, 0.62], "roles": {"Atlas/team": "terracotta"}},
    {"name": "yard", "prim": "box", "size": [1.9, 1.9, 0.02], "open": ["bottom", "+x", "-x", "+y", "-y"], "role": "road-paved", "shade": 1.02},
    {"name": "post", "prim": "box", "size": [0.06, 0.06, 0.3], "open": ["bottom"], "position": [-0.9, 0.2, 0], "role": "timber"},
    {"name": "post", "prim": "box", "size": [0.06, 0.06, 0.3], "open": ["bottom"], "position": [0.9, 0.2, 0], "role": "timber"},
    {"name": "post", "prim": "box", "size": [0.06, 0.06, 0.3], "open": ["bottom"], "position": [-0.9, 0.9, 0], "role": "timber"},
    {"name": "post", "prim": "box", "size": [0.06, 0.06, 0.3], "open": ["bottom"], "position": [0.9, 0.9, 0], "role": "timber"},
    {"name": "beam", "prim": "box", "size": [1.8, 0.035, 0.035], "position": [0, 0.2, 0.27], "role": "timber"},
    {"name": "beam", "prim": "box", "size": [1.8, 0.035, 0.035], "position": [0, 0.9, 0.27], "role": "timber"},
    {"name": "spread sail", "prim": "sail", "height": 0.66, "width": 1.7, "width_top": 1.1, "bulge": 0.04, "segments": 2, "position": [0, 0.22, 0.29], "rotation": [-82, 0, 0], "role": "canvas"},
    {"name": "rolled sail", "prim": "cylinder", "radius": 0.06, "height": 0.55, "segments": 5, "caps": true, "position": [0.75, 0, 0.06], "rotation": [0, 90, 0], "role": "canvas", "shade": 0.92, "lod": "full"},
    {"name": "rope coil", "prim": "lathe", "profile": [[0.1, 0], [0.12, 0.02], [0.1, 0.05], [0.05, 0.05], [0.05, 0]], "segments": 8, "position": [-0.8, 0, 0], "role": "thatch", "shade": 0.95, "lod": "full"}
  ]
}
