{
  "$schema": "./schema.json",
  "id": "pasture",
  "kind": "field",
  "notes": "Pasture field (2×2, sheep farm): grass slab inside a chunky post-and-rail fence on all four sides (neighbouring pastures simply stand side by side), two chunky sheep standing still (body, head, legs) and grass tufts. Static: the life layer animates the sheep later.",
  "parts": [
    {"name": "slab", "prim": "box", "size": [1.94, 1.94, 0.022], "open": ["bottom", "+x", "-x", "+y", "-y"], "role": "pasture"},
    {"name": "post", "prim": "box", "size": [0.07, 0.07, 0.24], "open": ["bottom"], "position": [-0.9, -0.9, 0], "repeat": {"count": 4, "step": [0.6, 0, 0]}, "role": "timber"},
    {"name": "post", "prim": "box", "size": [0.07, 0.07, 0.24], "open": ["bottom"], "position": [-0.9, 0.9, 0], "repeat": {"count": 4, "step": [0.6, 0, 0]}, "role": "timber"},
    {"name": "post", "prim": "box", "size": [0.07, 0.07, 0.24], "open": ["bottom"], "position": [-0.9, -0.3, 0], "repeat": {"count": 2, "step": [0, 0.6, 0]}, "role": "timber"},
    {"name": "post", "prim": "box", "size": [0.07, 0.07, 0.24], "open": ["bottom"], "position": [0.9, -0.3, 0], "repeat": {"count": 2, "step": [0, 0.6, 0]}, "role": "timber"},
    {"name": "rail", "prim": "box", "size": [1.84, 0.035, 0.045], "open": ["-x", "+x", "bottom"], "position": [0, -0.9, 0.08], "repeat": {"count": 2, "step": [0, 0, 0.09]}, "role": "timber", "shade": 1.15},
    {"name": "rail", "prim": "box", "size": [1.84, 0.035, 0.045], "open": ["-x", "+x", "bottom"], "position": [0, 0.9, 0.08], "repeat": {"count": 2, "step": [0, 0, 0.09]}, "role": "timber", "shade": 1.15},
    {"name": "rail", "prim": "box", "size": [0.035, 1.84, 0.045], "open": ["-y", "+y", "bottom"], "position": [-0.9, 0, 0.08], "repeat": {"count": 2, "step": [0, 0, 0.09]}, "role": "timber", "shade": 1.15},
    {"name": "rail", "prim": "box", "size": [0.035, 1.84, 0.045], "open": ["-y", "+y", "bottom"], "position": [0.9, 0, 0.08], "repeat": {"count": 2, "step": [0, 0, 0.09]}, "role": "timber", "shade": 1.15},
    {"name": "sheep", "prim": "rock", "size": [0.16, 0.11, 0.1], "position": [-0.38, 0.22, 0.13], "rotation": [0, 0, 20], "role": "canvas", "shade": 1.05},
    {"name": "sheep head", "prim": "box", "size": [0.08, 0.07, 0.08], "position": [-0.27193534860962054, 0.2593323164824519, 0.14], "rotation": [0, 0, 20], "role": "timber", "shade": 0.6},
    {"name": "sheep legs", "prim": "box", "size": [0.16, 0.09, 0.07], "open": ["bottom", "top"], "position": [-0.38, 0.22, 0.025], "rotation": [0, 0, 20], "role": "timber", "shade": 0.6},
    {"name": "sheep", "prim": "rock", "size": [0.16, 0.11, 0.1], "position": [0.42, -0.3, 0.13], "rotation": [0, 0, -140], "role": "canvas", "shade": 1.05},
    {"name": "sheep head", "prim": "box", "size": [0.08, 0.07, 0.08], "position": [0.33190488904131754, -0.37392057511395205, 0.14], "rotation": [0, 0, -140], "role": "timber", "shade": 0.6},
    {"name": "sheep legs", "prim": "box", "size": [0.16, 0.09, 0.07], "open": ["bottom", "top"], "position": [0.42, -0.3, 0.025], "rotation": [0, 0, -140], "role": "timber", "shade": 0.6},
    {"name": "tuft", "prim": "cylinder", "radius": 0.05, "radius_top": 0, "height": 0.11, "segments": 3, "position": [0.55, 0.5, 0.02], "role": "pasture-mark", "shade": 0.85},
    {"name": "tuft", "prim": "cylinder", "radius": 0.05, "radius_top": 0, "height": 0.11, "segments": 3, "position": [-0.6, -0.45, 0.02], "role": "pasture-mark", "shade": 0.85},
    {"name": "tuft", "prim": "cylinder", "radius": 0.05, "radius_top": 0, "height": 0.11, "segments": 3, "position": [0.05, 0.65, 0.02], "role": "pasture-mark", "shade": 0.85},
    {"name": "tuft", "prim": "cylinder", "radius": 0.05, "radius_top": 0, "height": 0.11, "segments": 3, "position": [-0.15, -0.05, 0.02], "role": "pasture-mark", "shade": 0.85}
  ]
}
