{
  "$schema": "./schema.json",
  "id": "bakery",
  "kind": "building",
  "notes": "Bakery: a two-storey KayKit home_B (0.62) under terracotta. Signature prop: the domed stone bread oven with its own chimney on the side, firewood and flour sacks.",
  "parts": [
    {"kit_building": "home_B", "position": [-0.25, -0.3, 0], "scale": 0.62, "roles": {"Atlas/team": "terracotta"}},
    {"name": "yard", "prim": "box", "size": [1.9, 1.9, 0.02], "open": ["bottom", "+x", "-x", "+y", "-y"], "role": "road-paved", "shade": 1.02},
    {"name": "oven dome", "prim": "lathe", "profile": [[0.42, 0], [0.42, 0.12], [0.38, 0.3], [0.25, 0.45], [0, 0.5]], "segments": 8, "position": [0.55, 0.45, 0], "role": "stone"},
    {"name": "oven mouth", "prim": "box", "size": [0.22, 0.05, 0.2], "position": [0.55, 0.86, 0.1], "role": "iron", "shade": 0.7},
    {"name": "oven chimney", "prim": "box", "size": [0.16, 0.16, 0.6], "open": ["bottom"], "position": [0.75, 0.25, 0.3], "role": "stone", "shade": 0.9},
    {"name": "log", "prim": "cylinder", "radius": 0.05, "height": 0.4, "segments": 5, "caps": true, "position": [0.7, -0.45, 0.05], "rotation": [90, 0, 0], "role": "timber", "shade": 1.02, "lod": "full"},
    {"name": "log", "prim": "cylinder", "radius": 0.05, "height": 0.4, "segments": 5, "caps": true, "position": [0.8, -0.45, 0.05], "rotation": [90, 0, 0], "role": "timber", "shade": 1.12, "lod": "full"},
    {"name": "flour sack", "prim": "rock", "size": [0.1, 0.08, 0.08], "position": [-0.75, 0.75, 0.07], "role": "canvas", "shade": 0.95, "lod": "full"},
    {"name": "flour sack", "prim": "rock", "size": [0.1, 0.08, 0.08], "position": [-0.55, 0.75, 0.07], "role": "canvas", "shade": 0.95, "lod": "full"}
  ]
}
