{
  "$schema": "./schema.json",
  "id": "hemp_field",
  "kind": "field",
  "notes": "Hemp field: green slab with three ridged rows of hemp, their tall stalk clumps breaking the row tops.",
  "parts": [
    {"name": "slab", "prim": "box", "size": [0.94, 0.94, 0.022], "open": ["bottom", "+x", "-x", "+y", "-y"], "role": "hemp"},
    {"name": "hemp row", "prim": "wedge", "size": [0.86, 0.2, 0.2], "position": [0, -0.3, 0.02], "role": "hemp-mark", "shade": 1.06},
    {"name": "hemp stalks", "prim": "cylinder", "radius": 0.06, "radius_top": 0, "height": 0.2, "segments": 3, "position": [-0.3, -0.32999999999999996, 0.1], "role": "hemp-mark", "shade": 0.9},
    {"name": "hemp stalks", "prim": "cylinder", "radius": 0.06, "radius_top": 0, "height": 0.24000000000000002, "segments": 3, "position": [-0.05, -0.27, 0.1], "role": "hemp-mark", "shade": 1.12},
    {"name": "hemp stalks", "prim": "cylinder", "radius": 0.06, "radius_top": 0, "height": 0.28, "segments": 3, "position": [0.2, -0.32999999999999996, 0.1], "role": "hemp-mark", "shade": 0.9},
    {"name": "hemp stalks", "prim": "cylinder", "radius": 0.06, "radius_top": 0, "height": 0.2, "segments": 3, "position": [0.36, -0.27, 0.1], "role": "hemp-mark", "shade": 1.12},
    {"name": "hemp row", "prim": "wedge", "size": [0.86, 0.2, 0.2], "position": [0, 0.0, 0.02], "role": "hemp-mark", "shade": 0.96},
    {"name": "hemp stalks", "prim": "cylinder", "radius": 0.06, "radius_top": 0, "height": 0.24000000000000002, "segments": 3, "position": [-0.3, -0.03, 0.1], "role": "hemp-mark", "shade": 1.12},
    {"name": "hemp stalks", "prim": "cylinder", "radius": 0.06, "radius_top": 0, "height": 0.28, "segments": 3, "position": [-0.05, 0.03, 0.1], "role": "hemp-mark", "shade": 0.9},
    {"name": "hemp stalks", "prim": "cylinder", "radius": 0.06, "radius_top": 0, "height": 0.2, "segments": 3, "position": [0.2, -0.03, 0.1], "role": "hemp-mark", "shade": 1.12},
    {"name": "hemp stalks", "prim": "cylinder", "radius": 0.06, "radius_top": 0, "height": 0.24000000000000002, "segments": 3, "position": [0.36, 0.03, 0.1], "role": "hemp-mark", "shade": 0.9},
    {"name": "hemp row", "prim": "wedge", "size": [0.86, 0.2, 0.2], "position": [0, 0.3, 0.02], "role": "hemp-mark", "shade": 1.06},
    {"name": "hemp stalks", "prim": "cylinder", "radius": 0.06, "radius_top": 0, "height": 0.28, "segments": 3, "position": [-0.3, 0.27, 0.1], "role": "hemp-mark", "shade": 0.9},
    {"name": "hemp stalks", "prim": "cylinder", "radius": 0.06, "radius_top": 0, "height": 0.2, "segments": 3, "position": [-0.05, 0.32999999999999996, 0.1], "role": "hemp-mark", "shade": 1.12},
    {"name": "hemp stalks", "prim": "cylinder", "radius": 0.06, "radius_top": 0, "height": 0.24000000000000002, "segments": 3, "position": [0.2, 0.27, 0.1], "role": "hemp-mark", "shade": 0.9},
    {"name": "hemp stalks", "prim": "cylinder", "radius": 0.06, "radius_top": 0, "height": 0.28, "segments": 3, "position": [0.36, 0.32999999999999996, 0.1], "role": "hemp-mark", "shade": 1.12}
  ]
}
