{
  "$schema": "./schema.json",
  "id": "shipyard",
  "kind": "building",
  "notes": "Shipyard (water-edge, D-051: the back two rows, -y, stand over the sea): an inclined slipway running from the yard into the water with a keel and ribs, a timber crane, a plank jetty on piles over the water, a KayKit home_A workshop under thatch, KayKit scaffolding on the jetty, log and plank piles and rope coils on the land rows. Signature prop: slipway with the hull frame (the ship under construction is drawn by the client on top).",
  "parts": [
    {"name": "yard", "prim": "box", "size": [4.9, 1.95, 0.02], "open": ["bottom", "+x", "-x", "+y", "-y"], "role": "road-dirt", "shade": 1.06, "position": [0, 0.98, 0]},
    {"name": "slipway", "prim": "box", "size": [1.6, 3.2, 0.06], "position": [0.6, -0.4, 0], "rotation": [3, 0, 0], "role": "timber", "shade": 1.05},
    {"name": "keel", "prim": "box", "size": [0.14, 2.6, 0.1], "position": [0.6, -0.4, 0.07], "rotation": [3, 0, 0], "role": "timber", "shade": 0.8},
    {"name": "rib", "prim": "box", "size": [0.11, 0.11, 0.6], "position": [0.18, -1.5, 0.05], "rotation": [0, -28, 0], "role": "timber", "shade": 0.85},
    {"name": "rib", "prim": "box", "size": [0.11, 0.11, 0.6], "position": [1.02, -1.5, 0.05], "rotation": [0, 28, 0], "role": "timber", "shade": 0.85},
    {"name": "rib", "prim": "box", "size": [0.11, 0.11, 0.6], "position": [0.18, -0.95, 0.05], "rotation": [0, -28, 0], "role": "timber", "shade": 0.85, "lod": "full"},
    {"name": "rib", "prim": "box", "size": [0.11, 0.11, 0.6], "position": [1.02, -0.95, 0.05], "rotation": [0, 28, 0], "role": "timber", "shade": 0.85, "lod": "full"},
    {"name": "rib", "prim": "box", "size": [0.11, 0.11, 0.6], "position": [0.18, -0.4, 0.05], "rotation": [0, -28, 0], "role": "timber", "shade": 0.85},
    {"name": "rib", "prim": "box", "size": [0.11, 0.11, 0.6], "position": [1.02, -0.4, 0.05], "rotation": [0, 28, 0], "role": "timber", "shade": 0.85},
    {"name": "rib", "prim": "box", "size": [0.11, 0.11, 0.6], "position": [0.18, 0.15, 0.05], "rotation": [0, -28, 0], "role": "timber", "shade": 0.85, "lod": "full"},
    {"name": "rib", "prim": "box", "size": [0.11, 0.11, 0.6], "position": [1.02, 0.15, 0.05], "rotation": [0, 28, 0], "role": "timber", "shade": 0.85, "lod": "full"},
    {"name": "rib", "prim": "box", "size": [0.11, 0.11, 0.6], "position": [0.18, 0.7, 0.05], "rotation": [0, -28, 0], "role": "timber", "shade": 0.85},
    {"name": "rib", "prim": "box", "size": [0.11, 0.11, 0.6], "position": [1.02, 0.7, 0.05], "rotation": [0, 28, 0], "role": "timber", "shade": 0.85},
    {"name": "post", "prim": "box", "size": [0.15, 0.15, 1.6], "open": ["bottom"], "position": [1.75, -1.7, 0], "role": "timber", "bevel": 0.03},
    {"name": "post", "prim": "box", "size": [0.15, 0.15, 1.6], "open": ["bottom"], "position": [1.75, 0.9, 0], "role": "timber", "bevel": 0.03},
    {"name": "beam", "prim": "box", "size": [2.6, 0.14, 0.14], "position": [1.75, -0.4, 1.56], "rotation": [0, 0, 90], "role": "timber"},
    {"name": "beam", "prim": "box", "size": [1.15, 0.1, 0.1], "position": [1.175, -0.3, 1.52], "rotation": [0, 0, 180], "role": "timber"},
    {"name": "crane rope", "prim": "box", "size": [0.025, 0.025, 0.7], "position": [0.6, -0.3, 0.82], "role": "timber", "shade": 0.65, "lod": "full"},
    {"name": "jetty", "prim": "box", "size": [2.3, 1.1, 0.05], "position": [-0.9, -1.35, 0.02], "role": "timber", "shade": 1.08, "lod": "full"},
    {"name": "jetty post", "prim": "box", "size": [0.09, 0.09, 0.64], "position": [-1.95, -1.85, -0.62], "role": "timber", "shade": 0.8, "open": ["bottom"], "lod": "full"},
    {"name": "jetty post", "prim": "box", "size": [0.09, 0.09, 0.64], "position": [0.15, -1.85, -0.62], "role": "timber", "shade": 0.8, "open": ["bottom"], "lod": "full"},
    {"name": "rope coil", "prim": "lathe", "profile": [[0.1, 0], [0.12, 0.02], [0.1, 0.05], [0.05, 0.05], [0.05, 0]], "segments": 8, "position": [2.1, 1.5, 0], "role": "thatch", "shade": 0.95, "lod": "full"},
    {"name": "rope coil", "prim": "lathe", "profile": [[0.1, 0], [0.12, 0.02], [0.1, 0.05], [0.05, 0.05], [0.05, 0]], "segments": 8, "position": [2.25, 1.25, 0], "role": "thatch", "shade": 0.9, "lod": "full"},
    {"name": "barrel", "kit": "kaykit_hexagon", "file": "Assets/gltf/decoration/props/barrel.gltf", "simplify": {"collapse": 0.4}, "position": [2.2, 1.5, 0], "scale": 0.55, "lod": "full"},
    {"name": "barrel", "kit": "kaykit_hexagon", "file": "Assets/gltf/decoration/props/barrel.gltf", "simplify": {"collapse": 0.4}, "position": [2.25, 1.75, 0], "scale": 0.55, "lod": "full"},
    {"kit_building": "home_A", "position": [-1.55, 0.8, 0], "scale": 0.78, "roles": {"Atlas/team": "thatch"}},
    {"name": "scaffolding", "kit": "kaykit_hexagon", "file": "Assets/gltf/buildings/neutral/building_scaffolding.gltf", "position": [-1.75, -1.2, 0], "scale": [0.42, 0.38, 0.5]},
    {"name": "logs", "kit": "kaykit_hexagon", "file": "Assets/gltf/decoration/props/resource_lumber.gltf", "position": [-0.3, 1.35, 0], "rotation": [0, 0, 4], "scale": 0.5},
    {"name": "planks", "kit": "kaykit_hexagon", "file": "Assets/gltf/decoration/props/pallet.gltf", "position": [0.6, 1.4, 0], "scale": 0.55},
    {"name": "planks", "kit": "kaykit_hexagon", "file": "Assets/gltf/decoration/props/crate_long_empty.gltf", "position": [0.6, 1.4, 0.06], "rotation": [0, 0, 90], "scale": 0.45, "lod": "full"},
    {"name": "crate", "kit": "kaykit_hexagon", "file": "Assets/gltf/decoration/props/crate_A_big.gltf", "position": [2.1, 0.15, 0], "scale": 0.5}
  ]
}
