{
  "$schema": "./schema.json",
  "id": "weaver_linen",
  "kind": "building",
  "notes": "Linen weaver: a two-storey KayKit home_B (0.6) with ochre walls under terracotta. Signature prop: cloth lines of bleached linen and blue-dyed lengths, with flax bundles.",
  "anchors": {"smoke": [-0.193, -1.08, 1.816], "chimney": [-0.193, -1.08, 1.766]},
  "parts": [
    {"kit_building": "home_B", "position": [0, -0.5, 0], "scale": 0.6, "roles": {"Atlas/team": "terracotta", "Atlas/white": {"role": "ochre", "shade": 1.08}}},
    {"name": "yard", "prim": "box", "size": [1.9, 1.9, 0.02], "open": ["bottom", "+x", "-x", "+y", "-y"], "role": "road-paved", "shade": 1.02},
    {"name": "post", "prim": "box", "size": [0.06, 0.06, 0.55], "open": ["bottom"], "position": [-0.85, 0.35, 0], "role": "timber"},
    {"name": "post", "prim": "box", "size": [0.06, 0.06, 0.55], "open": ["bottom"], "position": [0.85, 0.35, 0], "role": "timber"},
    {"name": "post", "prim": "box", "size": [0.06, 0.06, 0.55], "open": ["bottom"], "position": [-0.85, 0.8, 0], "role": "timber"},
    {"name": "post", "prim": "box", "size": [0.06, 0.06, 0.55], "open": ["bottom"], "position": [0.85, 0.8, 0], "role": "timber"},
    {"name": "beam", "prim": "box", "size": [1.7, 0.02, 0.02], "position": [0, 0.35, 0.52], "role": "timber"},
    {"name": "beam", "prim": "box", "size": [1.7, 0.02, 0.02], "position": [0, 0.8, 0.52], "role": "timber"},
    {"name": "cloth", "prim": "sail", "height": 0.4, "width": 0.6, "bulge": 0.03, "segments": 1, "position": [-0.4, 0.35, 0.13], "role": "canvas"},
    {"name": "cloth", "prim": "sail", "height": 0.36, "width": 0.55, "bulge": 0.03, "segments": 1, "position": [0.35, 0.35, 0.17], "role": "canvas", "shade": 1.08},
    {"name": "cloth", "prim": "sail", "height": 0.3, "width": 0.6, "bulge": 0.03, "segments": 1, "position": [-0.25, 0.8, 0.23], "role": "dye-blue", "shade": 1.1},
    {"name": "cloth", "prim": "sail", "height": 0.4, "width": 0.4, "bulge": 0.03, "segments": 1, "position": [0.45, 0.8, 0.13], "role": "canvas", "shade": 0.95},
    {"name": "flax bundle", "prim": "cylinder", "radius": 0.06, "radius_top": 0.025, "height": 0.3, "segments": 4, "position": [0.75, 0.05, 0], "role": "hemp-mark"},
    {"name": "flax bundle", "prim": "cylinder", "radius": 0.06, "radius_top": 0.025, "height": 0.3, "segments": 4, "position": [0.6, 0.05, 0], "role": "hemp-mark", "lod": "full"},
    {"name": "flax bundle", "prim": "cylinder", "radius": 0.06, "radius_top": 0.025, "height": 0.3, "segments": 4, "position": [0.45, 0.05, 0], "role": "hemp-mark", "lod": "full"}
  ]
}
