{
  "$schema": "./schema.json",
  "id": "hemp_farm",
  "kind": "building",
  "notes": "Hemp farm: a KayKit home_A farmhouse (0.7) under terracotta and a timber drying barn; the yard shows the hemp field type: bundled hemp stooks in a fenced plot and a drying rack. Signature prop: the hemp stooks and rack.",
  "parts": [
    {"kit_building": "home_A", "position": [0.8, -0.75, 0], "scale": [-0.7, 0.7, 0.7], "roles": {"Atlas/team": "terracotta"}},
    {"name": "yard", "prim": "box", "size": [2.9, 2.9, 0.02], "open": ["bottom", "+x", "-x", "+y", "-y"], "role": "road-dirt", "shade": 1.08},
    {"name": "post", "prim": "box", "size": [0.06, 0.06, 0.6], "open": ["bottom"], "position": [-1.35, -1.25, 0], "role": "timber"},
    {"name": "post", "prim": "box", "size": [0.06, 0.06, 0.6], "open": ["bottom"], "position": [-0.15, -1.25, 0], "role": "timber"},
    {"name": "post", "prim": "box", "size": [0.06, 0.06, 0.6], "open": ["bottom"], "position": [-1.35, -0.45, 0], "role": "timber"},
    {"name": "post", "prim": "box", "size": [0.06, 0.06, 0.6], "open": ["bottom"], "position": [-0.15, -0.45, 0], "role": "timber"},
    {"name": "roof", "prim": "wedge", "size": [1.4, 1, 0.3], "hip": 0.2, "position": [-0.75, -0.85, 0.6], "role": "terracotta", "shade": 0.95},
    {"name": "drying hemp", "prim": "cylinder", "radius": 0.06, "radius_top": 0.03, "height": 0.4, "segments": 4, "position": [-1.15, -0.85, 0.1], "role": "hemp-mark"},
    {"name": "drying hemp", "prim": "cylinder", "radius": 0.06, "radius_top": 0.03, "height": 0.4, "segments": 4, "position": [-0.95, -0.85, 0.1], "role": "hemp-mark", "lod": "full"},
    {"name": "drying hemp", "prim": "cylinder", "radius": 0.06, "radius_top": 0.03, "height": 0.4, "segments": 4, "position": [-0.75, -0.85, 0.1], "role": "hemp-mark"},
    {"name": "drying hemp", "prim": "cylinder", "radius": 0.06, "radius_top": 0.03, "height": 0.4, "segments": 4, "position": [-0.55, -0.85, 0.1], "role": "hemp-mark", "lod": "full"},
    {"name": "drying hemp", "prim": "cylinder", "radius": 0.06, "radius_top": 0.03, "height": 0.4, "segments": 4, "position": [-0.35, -0.85, 0.1], "role": "hemp-mark"},
    {"name": "hemp plot", "prim": "box", "size": [2.5, 1.35, 0.025], "open": ["bottom", "+x", "-x", "+y", "-y"], "position": [0, 0.7, 0], "role": "hemp", "shade": 0.95},
    {"name": "stook", "prim": "cylinder", "radius": 0.08, "radius_top": 0.02, "height": 0.36, "segments": 5, "position": [-0.9, 0.35, 0], "role": "hemp-mark", "shade": 1.05},
    {"name": "stook", "prim": "cylinder", "radius": 0.08, "radius_top": 0.02, "height": 0.36, "segments": 5, "position": [-0.9, 0.75, 0], "role": "hemp-mark", "lod": "full"},
    {"name": "stook", "prim": "cylinder", "radius": 0.08, "radius_top": 0.02, "height": 0.36, "segments": 5, "position": [-0.9, 1.1, 0], "role": "hemp-mark", "shade": 1.05},
    {"name": "stook", "prim": "cylinder", "radius": 0.08, "radius_top": 0.02, "height": 0.36, "segments": 5, "position": [-0.45, 0.35, 0], "role": "hemp-mark", "lod": "full"},
    {"name": "stook", "prim": "cylinder", "radius": 0.08, "radius_top": 0.02, "height": 0.36, "segments": 5, "position": [-0.45, 0.75, 0], "role": "hemp-mark", "shade": 1.05},
    {"name": "stook", "prim": "cylinder", "radius": 0.08, "radius_top": 0.02, "height": 0.36, "segments": 5, "position": [-0.45, 1.1, 0], "role": "hemp-mark", "lod": "full"},
    {"name": "stook", "prim": "cylinder", "radius": 0.08, "radius_top": 0.02, "height": 0.36, "segments": 5, "position": [0, 0.35, 0], "role": "hemp-mark", "shade": 1.05},
    {"name": "stook", "prim": "cylinder", "radius": 0.08, "radius_top": 0.02, "height": 0.36, "segments": 5, "position": [0, 0.75, 0], "role": "hemp-mark", "lod": "full"},
    {"name": "stook", "prim": "cylinder", "radius": 0.08, "radius_top": 0.02, "height": 0.36, "segments": 5, "position": [0, 1.1, 0], "role": "hemp-mark", "shade": 1.05},
    {"name": "stook", "prim": "cylinder", "radius": 0.08, "radius_top": 0.02, "height": 0.36, "segments": 5, "position": [0.45, 0.35, 0], "role": "hemp-mark", "lod": "full"},
    {"name": "stook", "prim": "cylinder", "radius": 0.08, "radius_top": 0.02, "height": 0.36, "segments": 5, "position": [0.45, 0.75, 0], "role": "hemp-mark", "shade": 1.05},
    {"name": "stook", "prim": "cylinder", "radius": 0.08, "radius_top": 0.02, "height": 0.36, "segments": 5, "position": [0.45, 1.1, 0], "role": "hemp-mark", "lod": "full"},
    {"name": "stook", "prim": "cylinder", "radius": 0.08, "radius_top": 0.02, "height": 0.36, "segments": 5, "position": [0.9, 0.35, 0], "role": "hemp-mark", "shade": 1.05},
    {"name": "stook", "prim": "cylinder", "radius": 0.08, "radius_top": 0.02, "height": 0.36, "segments": 5, "position": [0.9, 0.75, 0], "role": "hemp-mark", "lod": "full"},
    {"name": "stook", "prim": "cylinder", "radius": 0.08, "radius_top": 0.02, "height": 0.36, "segments": 5, "position": [0.9, 1.1, 0], "role": "hemp-mark", "shade": 1.05},
    {"name": "fence", "kit": "kaykit_hexagon", "file": "Assets/gltf/buildings/neutral/fence_wood_straight.gltf", "position": [0.0, 1.035, 0], "rotation": [0, 0, 90], "scale": [0.45, 0.98, 0.3], "lod": "full"}
  ]
}
