{
  "$schema": "./schema.json",
  "id": "mill",
  "kind": "building",
  "notes": "Mill: the KayKit windmill (0.8) with its timber cap under terracotta. Signature prop: the big sails on the front (+y); flour sacks and a cart by the door.",
  "anchors": {"smoke": [0.0, -0.1, 2.587], "chimney": [0.0, -0.1, 2.537]},
  "parts": [
    {"kit_building": "windmill", "position": [0, -0.1, 0], "scale": 0.8, "roles": {"Atlas/team": "terracotta"}},
    {"name": "yard", "prim": "box", "size": [1.9, 1.9, 0.02], "open": ["bottom", "+x", "-x", "+y", "-y"], "role": "road-dirt", "shade": 1.08},
    {"name": "flour sack", "prim": "rock", "size": [0.1, 0.08, 0.08], "position": [0.55, 0.65, 0.07], "role": "canvas", "shade": 0.95},
    {"name": "flour sack", "prim": "rock", "size": [0.1, 0.08, 0.08], "position": [0.7, 0.5, 0.07], "role": "canvas", "shade": 0.95, "lod": "full"},
    {"name": "flour sack", "prim": "rock", "size": [0.1, 0.08, 0.08], "position": [-0.6, 0.7, 0.07], "role": "canvas", "shade": 0.95, "lod": "full"},
    {"name": "cart", "prim": "box", "size": [0.4, 0.25, 0.25], "open": ["bottom"], "position": [-0.65, 0.6, 0], "role": "timber", "shade": 1.1, "lod": "full"},
    {"name": "wheel", "prim": "cylinder", "radius": 0.1, "height": 0.03, "segments": 6, "caps": true, "position": [-0.65, 0.47, 0.1], "rotation": [90, 0, 0], "role": "timber", "shade": 0.8, "lod": "full"}
  ]
}
