{
  "$schema": "./schema.json",
  "id": "brig",
  "kind": "ship",
  "notes": "Brig (tier 3 ship class between the sloop and the galleon, D-056): the KayKit ship as for the sloop at 2.6 tiles with its fore mast taken off above the deck (two masts: main and mizzen), a triangular jib on a stay to the bowsprit and blue pennants on both mastheads; the hull a plain timber. The cargo attachment stacks four simplified KayKit crates and barrels on the freed fore deck.",
  "ship": {
    "length_tiles": 2.6,
    "masts": 2,
    "sail_scale": 1.0
  },
  "parts": [
    {
      "name": "ship",
      "kit": "kaykit_hexagon",
      "file": "Assets/gltf/units/blue/ship_blue_accent.gltf",
      "simplify": {
        "dissolve": 1
      },
      "crop": {
        "min": [
          -2,
          -0.4,
          -1
        ],
        "max": [
          2,
          2,
          3
        ]
      },
      "rotation": [
        0,
        0,
        90
      ],
      "scale": 0.5,
      "position": [
        0,
        0,
        -0.15
      ],
      "roles": {
        "Atlas/team": "canvas",
        "Atlas/wood": {
          "role": "timber",
          "shade": 1.0
        }
      }
    },
    {
      "name": "ship",
      "kit": "kaykit_hexagon",
      "file": "Assets/gltf/units/blue/ship_blue_accent.gltf",
      "simplify": {
        "dissolve": 1
      },
      "crop": {
        "min": [
          -2,
          -0.9,
          -1
        ],
        "max": [
          2,
          -0.4,
          0.5
        ]
      },
      "rotation": [
        0,
        0,
        90
      ],
      "scale": 0.5,
      "position": [
        0,
        0,
        -0.15
      ],
      "roles": {
        "Atlas/team": "canvas",
        "Atlas/wood": {
          "role": "timber",
          "shade": 1.0
        }
      }
    },
    {
      "name": "ship",
      "kit": "kaykit_hexagon",
      "file": "Assets/gltf/units/blue/ship_blue_accent.gltf",
      "simplify": {
        "dissolve": 1
      },
      "crop": {
        "min": [
          -2,
          -3,
          -1
        ],
        "max": [
          2,
          -0.9,
          3
        ]
      },
      "rotation": [
        0,
        0,
        90
      ],
      "scale": 0.5,
      "position": [
        0,
        0,
        -0.15
      ],
      "roles": {
        "Atlas/team": "canvas",
        "Atlas/wood": {
          "role": "timber",
          "shade": 1.0
        }
      }
    },
    {
      "name": "jib",
      "prim": "sail",
      "width": 0.75,
      "height": 1.15,
      "width_top": 0.02,
      "bulge": 0.04,
      "position": [
        0.95,
        0.0,
        0.41
      ],
      "rotation": [
        0.0,
        -18.0,
        0.0
      ],
      "role": "canvas"
    },
    {
      "name": "jib stay",
      "prim": "box",
      "size": [
        0.03,
        0.03,
        1.3
      ],
      "open": [
        "bottom"
      ],
      "position": [
        1.15,
        0.0,
        0.31
      ],
      "rotation": [
        0.0,
        -32.0,
        0.0
      ],
      "role": "timber",
      "shade": 0.9
    },
    {
      "name": "flag",
      "prim": "box",
      "size": [
        0.32,
        0.02,
        0.12
      ],
      "position": [
        -0.23,
        0.0,
        2.446
      ],
      "role": "dye-blue",
      "shade": 1.0
    },
    {
      "name": "flag",
      "prim": "box",
      "size": [
        0.26,
        0.02,
        0.1
      ],
      "position": [
        -0.89,
        0.0,
        1.802
      ],
      "role": "dye-blue",
      "shade": 1.0
    }
  ],
  "attachments": {
    "cargo": [
      {
        "name": "crate",
        "kit": "kaykit_hexagon",
        "file": "Assets/gltf/decoration/props/crate_A_small.gltf",
        "simplify": {
          "collapse": 0.5
        },
        "position": [
          0.42,
          -0.15,
          0.31
        ],
        "rotation": [
          0,
          0,
          8
        ],
        "scale": 0.9
      },
      {
        "name": "crate",
        "kit": "kaykit_hexagon",
        "file": "Assets/gltf/decoration/props/crate_B_small.gltf",
        "simplify": {
          "collapse": 0.5
        },
        "position": [
          0.42,
          0.15,
          0.31
        ],
        "rotation": [
          0,
          0,
          -6
        ],
        "scale": 0.9,
        "roles": {
          "Atlas/beige": {
            "role": "timber",
            "shade": 1.2
          }
        }
      },
      {
        "name": "barrel",
        "kit": "kaykit_hexagon",
        "file": "Assets/gltf/decoration/props/barrel.gltf",
        "simplify": {
          "collapse": 0.35
        },
        "position": [
          0.72,
          -0.12,
          0.31
        ],
        "rotation": [
          0,
          0,
          14
        ],
        "scale": 0.558
      },
      {
        "name": "crate",
        "kit": "kaykit_hexagon",
        "file": "Assets/gltf/decoration/props/crate_A_small.gltf",
        "simplify": {
          "collapse": 0.5
        },
        "position": [
          0.72,
          0.14,
          0.31
        ],
        "rotation": [
          0,
          0,
          0
        ],
        "scale": 0.9
      }
    ]
  }
}
